{
  "type": "service",
  "title": "City Parcels 2026",
  "summary": "City of Honolulu parcels reference layer for 2026.",
  "description": "Authoritative parcel polygons for the City and County of Honolulu, refreshed monthly from the assessor database.",
  "tags": ["parcels", "honolulu", "reference"],
  "owner": {
    "id": "user-operator-honolulu",
    "name": "Honolulu Operator",
    "kind": "user"
  },
  "extent": {
    "bbox": [-158.3, 21.2, -157.6, 21.7],
    "crs": "EPSG:4326"
  },
  "nativeCrs": "EPSG:2784",
  "license": {
    "spdx": "CC-BY-4.0",
    "name": "Creative Commons Attribution 4.0",
    "url": "https://creativecommons.org/licenses/by/4.0/"
  },
  "attribution": "City and County of Honolulu",
  "source": {
    "kind": "publish",
    "sourceId": "honua-server-svc-01HXY3ZK7N1J2Q9V8M0FQ2PWAB",
    "jobId": "job-01HXY3ZK7N1J2Q9V8M0FQ2PWAC",
    "publishedBy": "user-operator-honolulu"
  },
  "target": {
    "type": "service",
    "serviceName": "city/parcels-2026",
    "kind": "feature",
    "layerCount": 1,
    "serviceUrl": "https://server.smoke.honua.example/api/v1/services/city-parcels-2026",
    "serviceType": "feature",
    "importJobId": "job-01HXY3ZK7N1J2Q9V8M0FQ2PWAC",
    "status": "available",
    "statusDetail": null,
    "adminDiagnosticsRef": "admin-diag-01HXY3ZK7N1J2Q9V8M0FQ2PWAD",
    "lastCheckedAt": "2026-05-22T18:00:00.000Z"
  },
  "endpoints": {
    "geoservices": {
      "accessURL": "https://server.smoke.honua.example/api/v1/services/city-parcels-2026",
      "format": "GeoServices:FeatureService",
      "mediaType": "application/json",
      "describedBy": "https://server.smoke.honua.example/api/v1/services/city-parcels-2026?f=help",
      "describedByType": "text/html",
      "conformsTo": ["https://developers.arcgis.com/rest/services-reference/feature-service.htm"]
    },
    "ogcFeatures": {
      "accessURL": "https://server.smoke.honua.example/ogc/features/collections/city-parcels-2026",
      "format": "OGC:API:Features",
      "mediaType": "application/geo+json",
      "describedBy": "https://server.smoke.honua.example/ogc/features/api",
      "describedByType": "application/vnd.oai.openapi+json;version=3.0",
      "conformsTo": [
        "http://www.opengis.net/spec/ogcapi-features-1/1.0/conf/core",
        "http://www.opengis.net/spec/ogcapi-features-1/1.0/conf/geojson"
      ]
    },
    "stac": null,
    "tiles": null
  },
  "preview": {
    "thumbnail": null,
    "image": null
  },
  "capabilities": ["query", "queryExtent", "render", "tiles"],
  "dependencies": [],
  "access": {
    "sharing": "private",
    "embeddable": false,
    "openData": false
  }
}
